{
  "$schema": "https://json-schema.org/draft/2020-12/schema",
  "$id": "https://raw.githubusercontent.com/renezander030/agent-approval-gate/v3.2.0/schemas/approval-record.schema.json",
  "title": "ApprovalRecord",
  "description": "An append-only terminal decision bound to the exact effective action and payload reviewed by the approver.",
  "type": "object",
  "required": [
    "schema_version",
    "approval_id",
    "request_id",
    "proposal_id",
    "request_revision",
    "action_hash",
    "payload_hash",
    "review_snapshot_id",
    "review_content_hash",
    "decision",
    "decided_by",
    "decided_at",
    "recorded_at",
    "channel",
    "policy_evaluation_id"
  ],
  "additionalProperties": false,
  "properties": {
    "schema_version": {"$ref": "common.schema.json#/$defs/schema_version"},
    "approval_id": {"$ref": "common.schema.json#/$defs/identifier"},
    "request_id": {"$ref": "common.schema.json#/$defs/identifier"},
    "proposal_id": {"$ref": "common.schema.json#/$defs/identifier"},
    "request_revision": {"type": "integer", "minimum": 1},
    "action_hash": {"$ref": "common.schema.json#/$defs/digest"},
    "payload_hash": {"$ref": "common.schema.json#/$defs/digest"},
    "review_snapshot_id": {"$ref": "common.schema.json#/$defs/identifier"},
    "review_content_hash": {"$ref": "common.schema.json#/$defs/digest"},
    "decision": {
      "type": "string",
      "enum": ["approved", "rejected", "expired", "cancelled", "auto_approved", "failed"]
    },
    "decided_by": {"$ref": "common.schema.json#/$defs/actor"},
    "decided_at": {"type": "string", "format": "date-time"},
    "recorded_at": {"type": "string", "format": "date-time"},
    "channel": {
      "type": "string",
      "enum": ["telegram", "slack", "email", "web", "n8n_form", "mcp_elicitation", "teams", "cli", "policy"]
    },
    "comment": {"type": "string", "maxLength": 2000},
    "modifications": {
      "type": "array",
      "minItems": 1,
      "maxItems": 100,
      "items": {"$ref": "common.schema.json#/$defs/action_patch_operation"}
    },
    "policy_evaluation_id": {"$ref": "common.schema.json#/$defs/identifier"},
    "signatures": {
      "type": "array",
      "minItems": 1,
      "maxItems": 8,
      "items": {"$ref": "common.schema.json#/$defs/signature"}
    },
    "rejection_settlement": {
      "type": "object",
      "required": ["state"],
      "additionalProperties": false,
      "properties": {
        "state": {
          "type": "string",
          "enum": ["verified_clean", "compensated", "unresolved"]
        },
        "verified_by": {"$ref": "common.schema.json#/$defs/actor"},
        "verified_at": {"type": "string", "format": "date-time"},
        "compensating_action_id": {"$ref": "common.schema.json#/$defs/identifier"},
        "evidence": {"$ref": "common.schema.json#/$defs/evidence_reference"},
        "note": {"type": "string", "maxLength": 2000}
      },
      "allOf": [
        {
          "if": {"properties": {"state": {"const": "verified_clean"}}, "required": ["state"]},
          "then": {
            "required": ["verified_by", "verified_at", "evidence"],
            "not": {"required": ["compensating_action_id"]}
          }
        },
        {
          "if": {"properties": {"state": {"const": "compensated"}}, "required": ["state"]},
          "then": {
            "required": [
              "verified_by",
              "verified_at",
              "compensating_action_id",
              "evidence"
            ]
          }
        },
        {
          "if": {"properties": {"state": {"const": "unresolved"}}, "required": ["state"]},
          "then": {
            "not": {
              "anyOf": [
                {"required": ["verified_by"]},
                {"required": ["verified_at"]},
                {"required": ["compensating_action_id"]},
                {"required": ["evidence"]}
              ]
            }
          }
        }
      ]
    }
  },
  "allOf": [
    {
      "if": {
        "properties": {
          "decided_by": {
            "properties": {"kind": {"const": "human"}},
            "required": ["kind"]
          }
        },
        "required": ["decided_by"]
      },
      "then": {
        "properties": {
          "decided_by": {
            "properties": {
              "authentication": {
                "properties": {"human_present": {"const": true}},
                "required": ["human_present"]
              }
            },
            "required": ["authentication"]
          }
        }
      }
    },
    {
      "if": {
        "properties": {
          "decided_by": {
            "properties": {"kind": {"const": "policy"}},
            "required": ["kind"]
          }
        },
        "required": ["decided_by"]
      },
      "then": {
        "properties": {
          "decided_by": {
            "properties": {
              "authentication": {
                "properties": {
                  "method": {"const": "policy_engine"},
                  "human_present": {"const": false}
                },
                "required": ["method", "human_present"]
              }
            },
            "required": ["authentication"]
          }
        }
      }
    },
    {
      "if": {"properties": {"decision": {"const": "approved"}}, "required": ["decision"]},
      "then": {
        "properties": {
          "decided_by": {
            "properties": {
              "kind": {"const": "human"},
              "authentication": {
                "properties": {"human_present": {"const": true}},
                "required": ["human_present"]
              }
            },
            "required": ["authentication"]
          },
          "channel": {
            "enum": ["telegram", "slack", "email", "web", "n8n_form", "mcp_elicitation", "teams", "cli"]
          }
        }
      }
    },
    {
      "if": {
        "properties": {"decision": {"const": "auto_approved"}},
        "required": ["decision"]
      },
      "then": {
        "required": ["policy_evaluation_id"],
        "properties": {
          "decided_by": {
            "properties": {"kind": {"const": "policy"}}
          },
          "channel": {"const": "policy"}
        },
        "not": {"required": ["modifications"]}
      }
    },
    {
      "if": {
        "properties": {"decision": {"enum": ["rejected", "expired"]}},
        "required": ["decision"]
      },
      "then": {"required": ["rejection_settlement"]}
    },
    {
      "if": {
        "properties": {
          "decision": {"enum": ["approved", "auto_approved", "cancelled", "failed"]}
        },
        "required": ["decision"]
      },
      "then": {"not": {"required": ["rejection_settlement"]}}
    },
    {
      "if": {"required": ["modifications"]},
      "then": {"properties": {"decision": {"const": "approved"}}}
    },
    {
      "if": {
        "properties": {
          "channel": {"enum": ["mcp_elicitation", "teams", "cli"]},
          "decision": {"enum": ["approved", "rejected"]}
        },
        "required": ["channel", "decision"]
      },
      "then": {
        "properties": {
          "decided_by": {
            "properties": {
              "kind": {"const": "human"},
              "authentication": {
                "properties": {
                  "method": {"enum": ["authenticated_session", "channel_identity", "signed_callback"]},
                  "human_present": {"const": true}
                },
                "required": ["method", "human_present"]
              }
            },
            "required": ["kind", "authentication"]
          }
        }
      }
    },
    {
      "if": {
        "properties": {
          "signatures": {
            "contains": {
              "properties": {"algorithm": {"const": "webauthn-es256"}},
              "required": ["algorithm"]
            }
          }
        },
        "required": ["signatures"]
      },
      "then": {
        "properties": {
          "channel": {"const": "web"},
          "decided_by": {
            "properties": {
              "kind": {"const": "human"},
              "authentication": {
                "properties": {
                  "method": {"const": "authenticated_session"},
                  "human_present": {"const": true},
                  "assurance": {"const": "high"}
                },
                "required": ["method", "human_present", "assurance"]
              }
            },
            "required": ["kind", "authentication"]
          }
        }
      }
    }
  ]
}
