{
  "schema_version": "3.3.0",
  "approval_id": "approval_2026-04-28_webauthn1",
  "request_id": "req_2026-04-28_6a2d8800",
  "proposal_id": "prop_2026-04-28_b3f1a2c4",
  "request_revision": 1,
  "action_hash": "sha256:e67cf5b14a0ecf2b2a86aa1f71be55d5524e962e91eba67edcc8cc840197cf11",
  "payload_hash": "sha256:c919182dcf3aa49d95f5927636aeb7a6a227fa9f9b3daa7384ac4c531a9f891b",
  "review_snapshot_id": "review_2026-04-28_47b2c000",
  "review_content_hash": "sha256:8c01b7a1cb615599ad2a3e2f36a282099ae522ed9115b14a7aec593be55b0d00",
  "decision": "approved",
  "decided_by": {
    "kind": "human",
    "identifier": "rene@acme-corp.example",
    "display_name": "Rene Z.",
    "roles": [
      "customer-support"
    ],
    "authentication": {
      "method": "authenticated_session",
      "human_present": true,
      "assurance": "high",
      "authenticated_at": "2026-04-28T09:14:30Z",
      "evidence_ref": "webauthn-session:session_2026-04-28_6dc90a00"
    }
  },
  "decided_at": "2026-04-28T09:14:30Z",
  "recorded_at": "2026-04-28T09:14:31Z",
  "channel": "web",
  "comment": "Reviewed the bound action details and approved with a passkey.",
  "policy_evaluation_id": "eval_2026-04-28_1c4f8a00",
  "signatures": [
    {
      "algorithm": "webauthn-es256",
      "key_id": "0cjNOhrHb5fQyIDYaRY4Xl9alS_ZqMfUMhHTUOdwD44",
      "value": "MEUCIQD1FkYv1lUDlXn3_pK1iE32vaTA59AlSBjXRKOv1xdsfAIgaDEnSiOPn5U9LufJls8_vzJEIRUwFHb5ECMto77eDwo",
      "signed_object_hash": "sha256:f709e0d05a8150cd7d547b866f885d5697c7666aa44f42ea1ae733f6b1cbcae1",
      "webauthn": {
        "credential_id": "0cjNOhrHb5fQyIDYaRY4Xl9alS_ZqMfUMhHTUOdwD44",
        "credential_public_key": "MFkwEwYHKoZIzj0CAQYIKoZIzj0DAQcDQgAEwTs5yuIWm75cZG8csjFhuwDbl58swFV1Dg9wMx7heTMY8zZXtOZpXSj0WgP5gICY76Nc8k3u39ELxbZlpWK8IA",
        "public_key_format": "spki-der",
        "authenticator_data": "Bh4i5kXWgfgyp3-i_7Tc6tPg1gtE80-ZMLP6GootWYQFAAAACQ",
        "client_data_json": "eyJ0eXBlIjoid2ViYXV0aG4uZ2V0IiwiY2hhbGxlbmdlIjoiOXduZzBGcUJVTTE5Vkh1R2I0aGRWcGZIWm1xa1QwTHFHdWN6OXJITHl1RSIsIm9yaWdpbiI6Imh0dHBzOi8vYXBwcm92ZS5hY21lLWNvcnAuZXhhbXBsZSIsImNyb3NzT3JpZ2luIjpmYWxzZX0",
        "rp_id": "acme-corp.example",
        "origin": "https://approve.acme-corp.example",
        "user_verification": "required",
        "previous_sign_count": 8,
        "sign_count": 9,
        "registration_evidence": {
          "kind": "webauthn_registration",
          "uri": "urn:acme:webauthn-registration:rene:2026-04-01",
          "digest": "sha256:e418276e56aaa3875a10b80dce662014d1d576704d0cbfff069c2c02583af160",
          "label": "Independently retained credential registration"
        }
      }
    }
  ]
}
