{
  "schema_version": "3.3.0",
  "approval_id": "approval_2026-04-28_f9821000",
  "request_id": "req_2026-04-28_6a2d8800",
  "proposal_id": "prop_2026-04-28_b3f1a2c4",
  "request_revision": 1,
  "action_hash": "sha256:e67cf5b14a0ecf2b2a86aa1f71be55d5524e962e91eba67edcc8cc840197cf11",
  "payload_hash": "sha256:c919182dcf3aa49d95f5927636aeb7a6a227fa9f9b3daa7384ac4c531a9f891b",
  "review_snapshot_id": "review_2026-04-28_47b2c000",
  "review_content_hash": "sha256:8c01b7a1cb615599ad2a3e2f36a282099ae522ed9115b14a7aec593be55b0d00",
  "decision": "approved",
  "decided_by": {
    "kind": "human",
    "identifier": "rene@acme-corp.example",
    "display_name": "Rene Z.",
    "roles": [
      "customer-support"
    ],
    "authentication": {
      "method": "signed_callback",
      "human_present": true,
      "assurance": "substantial",
      "authenticated_at": "2026-04-28T09:14:30Z",
      "evidence_ref": "mail-callback:mail_2026-04-28_3391"
    }
  },
  "decided_at": "2026-04-28T09:14:30Z",
  "recorded_at": "2026-04-28T09:14:31Z",
  "channel": "email",
  "comment": "Rate-limit explanation is accurate. Sending as drafted.",
  "signatures": [
    {
      "algorithm": "hmac-sha256",
      "key_id": "tenant-acme-2026-q2",
      "value": "H4f8GxQqI5kTMs7b4Y8cn2RlpdVLz0WGv8VUW0Sm5OU"
    }
  ],
  "policy_evaluation_id": "eval_2026-04-28_1c4f8a00"
}
