{
  "schema_version": "3.4.0",
  "approval_id": "approval_2026-04-28_f9821000",
  "request_id": "req_2026-04-28_6a2d8800",
  "proposal_id": "prop_2026-04-28_b3f1a2c4",
  "request_revision": 1,
  "action_hash": "sha256:fa91547ede90b5e71af350eeed3be5272dc40be522a84a6e32045ef8f4db1e64",
  "payload_hash": "sha256:c919182dcf3aa49d95f5927636aeb7a6a227fa9f9b3daa7384ac4c531a9f891b",
  "review_snapshot_id": "review_2026-04-28_47b2c000",
  "review_content_hash": "sha256:8c01b7a1cb615599ad2a3e2f36a282099ae522ed9115b14a7aec593be55b0d00",
  "decision": "approved",
  "decided_by": {
    "kind": "human",
    "identifier": "rene@acme-corp.example",
    "display_name": "Rene Z.",
    "roles": [
      "customer-support"
    ],
    "authentication": {
      "method": "authenticated_session",
      "human_present": true,
      "assurance": "high",
      "authenticated_at": "2026-04-28T09:14:30Z",
      "evidence_ref": "permission-protocol-receipt:cmexampleppreceipt0000000001"
    }
  },
  "decided_at": "2026-04-28T09:14:30Z",
  "recorded_at": "2026-04-28T09:14:31Z",
  "channel": "web",
  "comment": "Reviewed in Permission Protocol and signed with a passkey.",
  "policy_evaluation_id": "eval_2026-04-28_1c4f8a00",
  "signatures": [
    {
      "algorithm": "pp-receipt-ed25519",
      "key_id": "pp-example-2026-q2",
      "value": "nueu02prx5-4QILQ_OK3Jctzif5V7dgi5dg_xi_U2bMevloawi8tYMIcX7kcUsa29qMAI6dWGdxyZMw_dSvhDA",
      "permission_protocol": {
        "receipt_id": "cmexampleppreceipt0000000001",
        "issuer": "https://app.permissionprotocol.example",
        "canonicalization": "jcs_v2",
        "payload_bytes": "eyJhZ2VudElkIjoiYWdlbnQuc3VwcG9ydC10cmlhZ2UucHJvZCIsImF0dHJpYnV0aW9uQ29uZmlkZW5jZSI6ImNyZWRlbnRpYWxlZCIsImNhbm9uaWNhbGl6YXRpb24iOiJqY3NfdjIiLCJjb21wYW55SWQiOiJjb19hY21lX2V4YW1wbGUiLCJjcmVhdGVkQXQiOiIyMDI2LTA0LTI4VDA5OjE0OjMwLjAwMFoiLCJkZWNpZGVyQXV0aE1ldGhvZCI6InNlc3Npb25fc3RlcHVwX3dlYmF1dGhuIiwiZGVjaWRlckRpc3BsYXkiOiJyZW5lLWV4YW1wbGUiLCJkZWNpZGVySWQiOiJ1c2VyOnVzcl9leGFtcGxlX3JlbmUiLCJleHBpcmVzQXQiOiIyMDI2LTA0LTI4VDEwOjE0OjMwLjAwMFoiLCJpZCI6ImNtZXhhbXBsZXBwcmVjZWlwdDAwMDAwMDAwMDEiLCJpZGVtS2V5IjoiYWdlbnQtYXBwcm92YWwtZ2F0ZTpyZXFfMjAyNi0wNC0yOF82YTJkODgwMDoxOnNoYTI1NjpmYTkxNTQ3ZWRlOTBiNWU3MWFmMzUwZWVlZDNiZTUyNzJkYzQwYmU1MjJhODRhNmUzMjA0NWVmOGY0ZGIxZTY0IiwiaW5wdXRIYXNoIjoic2hhMjU2OjljNDViODI2MTMzYzUyOWUwMDJhOTBhNzM5YjU5MGEzZWQxODY4ODViNjkxY2FjM2JkNTliNDY4MGRhMDJkNTAiLCJwb2xpY3lWZXJzaW9uIjoicG9sX3YxX2hhcmRjb2RlZCIsInJlYXNvbkNvZGVzIjoiW1wiUFJPRFVDVElPTl9SRVFVSVJFU19BUFBST1ZBTFwiXSIsInJlY2VpcHRWZXJzaW9uIjoyLCJyZXF1ZXN0SnNvbiI6IntcImFjdGlvblwiOntcIm9wZXJhdGlvblwiOlwic2VuZFwiLFwicGFyYW1ldGVyc1wiOntcImJvZHlfdGV4dFwiOlwiSGksXFxuXFxuVGhhbmtzIGZvciB0aGUgcmVwb3J0LiBUaGUgZXhwb3J0IGVuZHBvaW50IHdhcyByYXRlLWxpbWl0ZWQgYWJvdmUgdGhlIGRvY3VtZW50ZWQgdGhyZXNob2xkIGxhc3Qgd2VlayDigJQgd2UndmUgcmFpc2VkIGl0IGJhY2sgdG8gNTAgcmVxL21pbi4gUGxlYXNlIHJldHJ5IHRoZSBNYXJjaCBleHBvcnQgYW5kIGxldCB1cyBrbm93IGlmIGl0IHN0aWxsIGZhaWxzLlxcblxcbklmIHlvdSBuZWVkIHRoZSBkYXRhIHNvb25lciwgSSBjYW4gcnVuIHRoZSBleHBvcnQgb24gb3VyIHNpZGUgYW5kIGVtYWlsIHlvdSB0aGUgQ1NWIGRpcmVjdGx5LlxcblxcbkJlc3QsXFxuU3VwcG9ydFwiLFwiY2NcIjpbXSxcImZyb21cIjpcInN1cHBvcnRAYWNtZS1jb3JwLmV4YW1wbGVcIixcImluX3JlcGx5X3RvX21lc3NhZ2VfaWRcIjpcIjxDQUR4N0huWkBleGFtcGxlLmNvbT5cIixcInN1YmplY3RcIjpcIlJlOiBjYW5ub3QgZXhwb3J0IGludm9pY2VzIGZvciBNYXJjaFwiLFwidGlja2V0X2lkXCI6XCJaRC00ODIxMVwiLFwidG9cIjpbXCJjdXN0b21lckBleGFtcGxlLmNvbVwiXX0sXCJ0b29sXCI6XCJlbWFpbFwifSxcImFjdG9yXCI6e1wiYWdlbnRJZFwiOlwiYWdlbnQuc3VwcG9ydC10cmlhZ2UucHJvZFwiLFwicnVuSWRcIjpcInJ1bl8yMDI2LTA0LTI4XzVmOWUyYzAwXCJ9LFwiY29uc3RyYWludHNcIjp7XCJpZGVtcG90ZW5jeUtleVwiOlwiYWdlbnQtYXBwcm92YWwtZ2F0ZTpyZXFfMjAyNi0wNC0yOF82YTJkODgwMDoxOnNoYTI1NjpmYTkxNTQ3ZWRlOTBiNWU3MWFmMzUwZWVlZDNiZTUyNzJkYzQwYmU1MjJhODRhNmUzMjA0NWVmOGY0ZGIxZTY0XCJ9LFwiY29udGV4dFwiOntcImVudmlyb25tZW50XCI6XCJwcm9kdWN0aW9uXCIsXCJyZXZlcnNpYmlsaXR5XCI6XCJJUlJFVkVSU0lCTEVcIn0sXCJoYXNoZXNcIjp7XCJpbnB1dEhhc2hcIjpcInNoYTI1Njo5YzQ1YjgyNjEzM2M1MjllMDAyYTkwYTczOWI1OTBhM2VkMTg2ODg1YjY5MWNhYzNiZDU5YjQ2ODBkYTAyZDUwXCJ9LFwiaW50ZW50XCI6e1wiY2F0ZWdvcnlcIjpcImFnZW50LWFwcHJvdmFsLWdhdGVcIixcIm5hbWVcIjpcImVtYWlsLnNlbmRcIixcInN1bW1hcnlcIjpcImVtYWlsLnNlbmQgaGVsZCBieSByZXF1ZXN0IHJlcV8yMDI2LTA0LTI4XzZhMmQ4ODAwXCJ9LFwidGVuYW50SWRcIjpcImNvX2FjbWVfZXhhbXBsZVwifSIsInJlc29sdXRpb25UeXBlIjoiYWxsb3dfb25jZSIsInJpc2tUaWVyIjoiQ19FWEVDVVRFX1dJVEhfQVBQUk9WQUwiLCJydW5JZCI6InJ1bl8yMDI2LTA0LTI4XzVmOWUyYzAwIiwic2NvcGUiOiJwcm9kdWN0aW9uIiwic2lnbmF0dXJlQWxnIjoiZWQyNTUxOSIsInNpZ25hdHVyZUtleUlkIjoicHAtZXhhbXBsZS0yMDI2LXEyIiwic3RhdHVzIjoiQVBQUk9WRUQiLCJzdW1tYXJ5IjoiUHJvZHVjdGlvbiBlbnZpcm9ubWVudCByZXF1aXJlcyBodW1hbiBhcHByb3ZhbCJ9",
        "signed_payload_hash": "sha256:fc68c9682d556c265533accb8fc09c7d61449002deabcac720bd24ccf3f16d4a",
        "issuer_public_key": "7Cn1vdTYy2Rm1zV5FrV2TB0FbX32CnkjLz_xgX2iaF8",
        "key_evidence": {
          "kind": "permission_protocol_key",
          "uri": "urn:acme:permission-protocol-keys:2026-04-28",
          "digest": "sha256:8ccd0251fec49f4af383efd53aaaccf942e9f5f3b9896aff2a30fd046b0bacc1",
          "label": "Retained copy of the issuer's published key set"
        }
      }
    }
  ]
}
